ENTITY_ID,INFO_SOURCE,ENTITY_TYPE,BRIEF_NAME,GENDER,EXISTING_STATUS,BIRTH_PLACE,PROFILE_NOTES,DATE_OF_BIRTH,DATE_OF_DEATH,ACTIVE_STATUS,COMP_CODE,DECEASED,HIGH_RISK_COUNTRY,HIGH_RISK_COUNTRY_SCORE,FALSE_POSITIVE,FALSE_POSITIVE_EXPIRY_DT,BATCH_NO,BATCH_DATE,APPROVAL_STATUS,RJ_REMARKS,APPROVED_BY,APPROVED_DT,APPROVED_TM,ACTION,LAST_UPDATE_DATE,STAMP_DTTM,USER_ID,MODE_MN
"113324","FREEZE-04-UN1267","PERSON","None","Other","0","","Father''s name is Abdullah Shalabi. Mother''s name is Ammnih Shalabi. Associated with Djamel Moustfa (QI.M.129.03.), Mohamed Abu Dhess (QI.A.130.03.) and Aschraf al-Dagma (QI.A.132.03.). Review pursuant to Security Council resolution 1822 (2008) was concluded on 21 Jun. 2010.","","","ACTIVE","1","No","","0","0","0","","","0","","","0","0","add","20130603","20130603","","A"
"111782","FREEZE-04-UN1267","PERSON","None","Other","0","","Review pursuant to Security Council resolution 1822 (2008) was concluded on 15 Jun. 2010.","","","ACTIVE","1","No","","0","0","0","","","0","","","0","0","add","20130603","20130603","","A"
"113220","FREEZE-04-UN1267","PERSON","None","Other","0","","Review pursuant to Security Council resolution 1822 (2008) was concluded on 25 May 2010.","","","ACTIVE","1","No","","0","0","0","","","0","","","0","0","add","20130603","20130603","","A"
"113439","FREEZE-04-UN1267","PERSON","None","Other","0","","Review pursuant to Security Council resolution 1822 (2008) was concluded on 19 Jun. 2009.","","","ACTIVE","1","No","","0","0","0","","","0","","","0","0","add","20130603","20130603","","A"
"2786786","FREEZE-04-UN1267","PERSON","None","Other","0","","Involved in the financing of, arms supply to, recruitment for and otherwise provided assistance to the Abu Sayyaf Group (QE.A.1.01.). Review pursuant to Security Council resolution 1822 (2008) was concluded on 14 Sep. 2009.","","","ACTIVE","1","No","","0","0","0","","","0","","","0","0","add","20130603","20130603","","A"
"113222","FREEZE-04-UN1267","PERSON","None","Other","0","","Review pursuant to Security Council resolution 1822 (2008) was concluded on 25 May 2010.","","","ACTIVE","1","No","","0","0","0","","","0","","","0","0","add","20130603","20130603","","A"
"111639","FREEZE-04-UN1267","PERSON","None","Other","0","","Associated with Afghan Support Committee (ASC) (QE.A.69.02.), Revival of Islamic Heritage Society (RIHS)(QE.R.70.02.) and the Libyan Islamic Fighting Group (LIFG) (QE.L.11.01.). Review pursuant to Security Council resolution 1822 (2008) was concluded on 8 Jun. 2010.","","","ACTIVE","1","No","","0","0","0","","","0","","","0","0","add","20130603","20130603","","A"
"2813362","FREEZE-04-UN1267","PERSON","None","Other","0","","Distinguishing marks include scars on both legs. Member of the Rajah Solaiman Movement (QE.R.128.08.), and associated with the Abu Sayyaf Group (QE.A.1.01.) and the Jemaah Islamiyah (QE.J.92.02.). In detention in the Philippines as of May 2011. Review pursuant to Security Council resolution 1822 (2008) was concluded on 13 May 2010.","","","ACTIVE","1","No","","0","0","0","","","0","","","0","0","add","20130603","20130603","","A"
"113440","FREEZE-04-UN1267","PERSON","None","Other","0","","Served as a director of Ummah Tameer e-Nau (UTN) (QE.U.68.01). Review pursuant to Security Council resolution 1822 (2008) was concluded on 1 Jun. 2010.","","","ACTIVE","1","No","","0","0","0","","","0","","","0","0","add","20130603","20130603","","A"
"2960872","FREEZE-04-UN1267","PERSON","None","Other","0","","Resides in the Russian Federation as at Nov. 2010. International arrest warrant issued in the year 2000.","","","ACTIVE","1","No","","0","0","0","","","0","","","0","0","add","20130603","20130603","","A"
"2935076","FREEZE-04-UN1267","PERSON","None","Other","0","","Reportedly born in South Waziristan, Pakistan, and believed to be residing in Pakistan. Emir of Tehrik-e Taliban Pakistan (TTP) (QE.T.132.11.) for South Waziristan Agency, Federally Administered Tribal Areas, Pakistan.","","","ACTIVE","1","No","","0","0","0","","","0","","","0","0","add","20130603","20130603","","A"
"112283","FREEZE-04-UN1267","PERSON","None","Other","0","","Associated with Al-Qaida-related groups in the United Kingdom and other countries. Convicted in absentia in Jordan for involvement in terrorist acts in 1998. Arrested in Feb. 2001 in the United Kingdom, was further detained between Oct. 2002 and Mar. 2005 and between Aug. 2005 and Jun. 2008. In custody in the United Kingdom since Dec. 2008 pending the outcome of deportation proceedings (as at Mar. 2009). Review pursuant to Security Council resolution 1822 (2008) was concluded on 19 Oct. 2009.","","","ACTIVE","1","No","","0","0","0","","","0","","","0","0","add","20130603","20130603","","A"
"113328","FREEZE-04-UN1267","PERSON","None","Other","0","","Abdul Rahman Yasin is in Iraq. Review pursuant to Security Council resolution 1822 (2008) was concluded on 21 Jun. 2010.","","","ACTIVE","1","No","","0","0","0","","","0","","","0","0","add","20130603","20130603","","A"
"2830354","FREEZE-04-UN1267","PERSON","None","Other","0","","Associated with the Islamic Jihad Union (IJU), also known as the Islamic Jihad Group (QE.I.119.05.). Associated with Fritz Martin Gelowicz (QI.G.259.08.) and Daniel Martin Schneider (QI.S.260.08.). In detention in Germany as of Jun. 2010.","","","ACTIVE","1","No","","0","0","0","","","0","","","0","0","add","20130603","20130603","","A"
"112285","FREEZE-04-UN1267","PERSON","None","Other","0","","Member of Ansar Al-Islam (QE.A.98.03). Sentenced on 15 Jul. 2008 to 8 years imprisonment in Germany. Review pursuant to Security Council resolution 1822 (2008) was concluded on 30 Jul. 2009.","","","ACTIVE","1","No","","0","0","0","","","0","","","0","0","add","20130603","20130603","","A"
"112021","FREEZE-04-UN1267","PERSON","None","Other","0","","Father''s name is Mohamed Elsayed Elsebai. Review pursuant to Security Council resolution 1822 (2008) was concluded on 29 Jul. 2010.","","","ACTIVE","1","No","","0","0","0","","","0","","","0","0","add","20130603","20130603","","A"
"111922","FREEZE-04-UN1267","PERSON","None","Other","0","","Mother’s name is Zina al-Zarkaoui. Imprisoned in France since 1 Feb. 2010 on charges of criminal conspiracy in relation to a terrorist organization. Review pursuant to Security Council resolution 1822 (2008) was concluded on 6 May 2010.","","","ACTIVE","1","No","","0","0","0","","","0","","","0","0","add","20130603","20130603","","A"
"113330","FREEZE-04-UN1267","PERSON","None","Other","0","","Former member of The Organization of Al-Qaida in the Islamic Maghreb (QE.T.14.01.). Confirmed to have died in northern Mali on 19 Sep. 2006. Review pursuant to Security Council resolution 1822 (2008) was concluded on 27 Jul. 2010.","","","ACTIVE","1","No","","0","0","0","","","0","","","0","0","add","20130603","20130603","","A"
"2758288","FREEZE-04-UN1267","PERSON","None","Other","0","","Considered a fugitive from justice by the Italian authorities and sentenced in absentia to 6 years imprisonment on 20 Nov. 2008. Member of Libyan Islamic Fighting Group (QE.L.11.01). Review pursuant to Security Council resolution 1822 (2008) was concluded on 20 Jul. 2009.","","","ACTIVE","1","No","","0","0","0","","","0","","","0","0","add","20130603","20130603","","A"
"113444","FREEZE-04-UN1267","PERSON","None","Other","0","","Review pursuant to Security Council resolution 1822 (2008) was concluded on 8 Jun. 2010.","","","ACTIVE","1","No","","0","0","0","","","0","","","0","0","add","20130603","20130603","","A"
"113459","FREEZE-04-UN1267","ENTITY","None","Other","0","","","","","ACTIVE","1","No","","0","0","0","","","0","","","0","0","add","20130603","20130603","","A"
"113445","FREEZE-04-UN1267","ENTITY","None","Other","0","","Associated with Jemaah Islamiyah (JI) (QE.J.92.02). Current leader is Radulan Sahiron (QI.S.208.05). Review pursuant to Security Council resolution 1822 (2008) was concluded on 21 Jun. 2010.","","","ACTIVE","1","No","","0","0","0","","","0","","","0","0","add","20130603","20130603","","A"
"113226","FREEZE-04-UN1267","ENTITY","None","Other","0","","Associated with the Revival of Islamic Heritage Society (QE.R.70.02). Abu Bakr al-Jaziri (QI.A.58.02) served as finance chief of ASC. Review pursuant to Security Council resolution 1822 (2008) was concluded on 8 Jun. 2010.","","","ACTIVE","1","No","","0","0","0","","","0","","","0","0","add","20130603","20130603","","A"
"113227","FREEZE-04-UN1267","ENTITY","None","Other","0","","Regional offices in Pakistan: Bahawalpur, Bawalnagar, Gilgit, Islamabad, Mirpur Khas, Tando-Jan-Muhammad. Akhtarabad Medical Camp is in Spin Boldak, Afghanistan. Registered by members of Jaish-i-Mohammed (QE.J.19.01). Associated with Harakat ul-Mujahidin/ HUM (QE.H.8.01), Lashkar I Jhanghvi (LJ) (QE.L.96.03) and Lashkar-e-Tayyiba (QE.L.118.05). Banned in Pakistan. Review pursuant to Security Council resolution 1822 (2008) was concluded on 14 Sep. 2009.","","","ACTIVE","1","No","","0","0","0","","","0","","","0","0","add","20130603","20130603","","A"
"113231","FREEZE-04-UN1267","ENTITY","None","Other","0","","Registered in Bosnia and Herzegovina as a citizens’ association under the name of “Citizens’ Association for Support and Prevention of lies – Furqan” on 26 Sep. 1997. Al Furqan ceased its work by decision of the Ministry of Justice of the Bosnia and Herzegovina Federation (decision number 03-054-286/97 dated 8 Nov. 2002). Al Furqan was no longer in existence as at Dec. 2008. Review pursuant to Security Council resolution 1822 (2008) was concluded on 15 Jun. 2010.","","","ACTIVE","1","No","","0","0","0","","","0","","","0","0","add","20130603","20130603","","A"
"113453","FREEZE-04-UN1267","ENTITY","None","Other","0","","Review pursuant to Security Council resolution 1822 (2008) was concluded on 22 Jun. 2010.","","","ACTIVE","1","No","","0","0","0","","","0","","","0","0","add","20130603","20130603","","A"
"113335","FREEZE-04-UN1267","ENTITY","None","Other","0","","Review pursuant to Security Council resolution 1822 (2008) was concluded on 22 Jun. 2010.","","","ACTIVE","1","No","","0","0","0","","","0","","","0","0","add","20130603","20130603","","A"
"113232","FREEZE-04-UN1267","ENTITY","None","Other","0","","Used to be officially registered in Bosnia and Herzegovina under registry number 24. Al-Haramain & Al Masjed Al-Aqsa Charity Foundation ceased its work by decision of the Ministry of Justice of the Bosnia and Herzegovina Federation (decision on cessation of operation number 03-05-2-203/04). It was no longer in existence as at Dec. 2008. Its premises and humanitarian activities were transferred under Government supervision to a new entity called Sretna Buducnost. Review pursuant to Security Council resolution 1822 (2008) was concluded on 22 Jun. 2010.","","","ACTIVE","1","No","","0","0","0","","","0","","","0","0","add","20130603","20130603","","A"
"113454","FREEZE-04-UN1267","ENTITY","None","Other","0","","Review pursuant to Security Council resolution 1822 (2008) was concluded on 22 Jun. 2010.","","","ACTIVE","1","No","","0","0","0","","","0","","","0","0","add","20130603","20130603","","A"
"113233","FREEZE-04-UN1267","ENTITY","None","Other","0","","Review pursuant to Security Council resolution 1822 (2008) was concluded on 22 Jun. 2010.","","","ACTIVE","1","No","","0","0","0","","","0","","","0","0","add","20130603","20130603","","A"
"113336","FREEZE-04-UN1267","ENTITY","None","Other","0","","Review pursuant to Security Council resolution 1822 (2008) was concluded on 22 Jun. 2010.","","","ACTIVE","1","No","","0","0","0","","","0","","","0","0","add","20130603","20130603","","A"
"113455","FREEZE-04-UN1267","ENTITY","None","Other","0","","Review pursuant to Security Council resolution 1822 (2008) was concluded on 19 Oct. 2009.","","","ACTIVE","1","No","","0","0","0","","","0","","","0","0","add","20130603","20130603","","A"
"113234","FREEZE-04-UN1267","ENTITY","None","Other","0","","Review pursuant to Security Council resolution 1822 (2008) was concluded on 22 Jun. 2010.","","","ACTIVE","1","No","","0","0","0","","","0","","","0","0","add","20130603","20130603","","A"
"113337","FREEZE-04-UN1267","ENTITY","None","Other","0","","The United States-based branch of Al-Haramain Foundation was formally established by Suliman Hamd Suleiman al-Buthe (QI.A.179.04.) and another associate in 1997. Review pursuant to Security Council resolution 1822 (2008) was concluded on 19 Oct. 2009.","","","ACTIVE","1","No","","0","0","0","","","0","","","0","0","add","20130603","20130603","","A"
"113456","FREEZE-04-UN1267","ENTITY","None","Other","0","","Under criminal investigation by the authorities of Bosnia and Herzegovina as of Nov. 2007. Employees and associates include Najib Ben Mohamed Ben Salem Al-Waz (listed under permanent reference number QI.A.104.03.). Review pursuant to Security Council resolution 1822 (2008) was concluded on 22 Jun. 2010.","","","ACTIVE","1","No","","0","0","0","","","0","","","0","0","add","20130603","20130603","","A"
"244845","FREEZE-04-UN1267","ENTITY","None","Other","0","","The founder and former leader is Aqeel Abdulaziz Aqeel al-Aqeel (QI.A.171.04). Review pursuant to Security Council resolution 1822 (2008) was concluded on 22 Jun. 2010.","","","ACTIVE","1","No","","0","0","0","","","0","","","0","0","add","20130603","20130603","","A"
"113235","FREEZE-04-UN1267","ENTITY","None","Other","0","","The founder and former leader is Aqeel Abdulaziz Aqeel al-Aqeel (QI.A.171.04) who was also chairman of its board of directors. Review pursuant to Security Council resolution 1822 (2008) was concluded on 28 Jun. 2010.","","","ACTIVE","1","No","","0","0","0","","","0","","","0","0","add","20130603","20130603","","A"
"113338","FREEZE-04-UN1267","ENTITY","None","Other","0","","Review pursuant to Security Council resolution 1822 (2008) was concluded on 22 Jun. 2010.","","","ACTIVE","1","No","","0","0","0","","","0","","","0","0","add","20130603","20130603","","A"
"113339","FREEZE-04-UN1267","ENTITY","None","Other","0","","Review pursuant to Security Council resolution 1822 (2008) was concluded on 22 Jun. 2010.","","","ACTIVE","1","No","","0","0","0","","","0","","","0","0","add","20130603","20130603","","A"
"113457","FREEZE-04-UN1267","ENTITY","None","Other","0","","Reported to have operated in Somalia and Ethiopia and to have merged with Harakat Al-Shabaab Al-Mujaahidiin (Al-Shabaab), which was accepted as an affiliate of Al-Qaida (QE.A.4.01) by Aiman Muhammed Rabi al-Zawahiri (QI.A.6.01) in Feb. 2012, and is also subject to the sanctions measures set out in Security Council resolution 1844 (2008) concerning Somalia and Eritrea (see www.un.org/sc/committees/751/index.shtml). Leadership included Hassan Abdullah Hersi Al-Turki (QI.A.172.04.) and Hassan Dahir Aweys (QI.D.42.01.). AIAI has received funds through the Al-Haramain Islamic Foundation (Somalia) (QE.A.72.02). Review pursuant to Security Council resolution 1822 (2008) was concluded on 21 Jun. 2010.","","","ACTIVE","1","No","","0","0","0","","","0","","","0","0","add","20130603","20130603","","A"
"113458","FREEZE-04-UN1267","ENTITY","None","Other","0","","Review pursuant to Security Council resolution 1822 (2008) was concluded on 21 Jun. 2010.","","","ACTIVE","1","No","","0","0","0","","","0","","","0","0","add","20130603","20130603","","A"
"113966","FREEZE-04-UN1267","ENTITY","None","Other","0","","Review pursuant to Security Council resolution 1822 (2008) was concluded on 25 May 2010.","","","ACTIVE","1","No","","0","0","0","","","0","","","0","0","add","20130603","20130603","","A"
"2881836","FREEZE-04-UN1267","ENTITY","None","Other","0","","AQAP is a regional affiliate of Al-Qaida (QE.A.4.01) and an armed group operating primarily in Arabian Peninsula. Location: Yemen. Alternative location: Saudi Arabia (2004 – 2006). Formed in Jan. 2009 when Al-Qaida in Yemen combined with Saudi Arabian Al-Qaida operatives. Leader of AQAP is Nasir ''abd-al-Karim ''Abdullah Al-Wahishi (QI.A.274.10.) and his deputy is Said Ali Al-Shihri (QI.A.275.10.). Ansar al-Shari’a was formed in early 2011 by AQAP and has taken responsibility for multiple attacks in Yemen against both government and civilian targets.","","","ACTIVE","1","No","","0","0","0","","","0","","","0","0","add","20130603","20130603","","A"
"113460","FREEZE-04-UN1267","ENTITY","None","Other","0","","The founder is Najmuddin Faraj Ahmad (QI.A.226.06). Associated with Al-Qaida in Iraq (QE.J.115.04). Located and primarily active in northern Iraq but maintains a presence in western and central Iraq. Review pursuant to Security Council resolution 1822 (2008) was concluded on 21 Jun. 2010.","","","ACTIVE","1","No","","0","0","0","","","0","","","0","0","add","20130603","20130603","","A"
"3014161","FREEZE-04-UN1267","ENTITY","None","Other","0","","Was founded in December 2011 by Iyad ag Ghali (QI.A.316.13.). Linked to the Organization of Al-Qaida in the Islamic Maghreb (QE.T.14.01) and Mouvement pour l’Unification et le Jihad en Afrique de l’Ouest (MUJAO) (QE.M.134.12). Associated with Abdelmalek Droukdel (QI.D.232.07.).","","","ACTIVE","1","No","","0","0","0","","","0","","","0","0","add","20130603","20130603","","A"
"113237","FREEZE-04-UN1267","ENTITY","None","Other","0","","Review pursuant to Security Council resolution 1822 (2008) was concluded on 21 Jun. 2010.","","","ACTIVE","1","No","","0","0","0","","","0","","","0","0","add","20130603","20130603","","A"
"113461","FREEZE-04-UN1267","ENTITY","None","Other","0","","Active in northern Iraq. Associated with Al-Qaida in Iraq (QE.J.115.04). Review pursuant to Security Council resolution 1822 (2008) was concluded on 21 Jun. 2010.","","","ACTIVE","1","No","","0","0","0","","","0","","","0","0","add","20130603","20130603","","A"
"113474","FREEZE-04-UN1267","ENTITY","None","Other","0","","Employer Identification Number (United States of America): 36-3823186. Associated with Benevolence International Fund (QE.B.94.02). Review pursuant to Security Council resolution 1822 (2008) was concluded on 22 Jun. 2010.","","","ACTIVE","1","No","","0","0","0","","","0","","","0","0","add","20130603","20130603","","A"
"113245","FREEZE-04-UN1267","ENTITY","None","Other","0","","Associated with the Armed Islamic Group (GIA) (QE.A.6.01) and the Organization of Al-Qaida in the Islamic Maghreb (QE.T.14.01). Review pursuant to Security Council resolution 1822 (2008) was concluded on 30 Jul. 2009.","","","ACTIVE","1","No","","0","0","0","","","0","","","0","0","add","20130603","20130603","","A"
"113356","FREEZE-04-UN1267","ENTITY","None","Other","0","","Active in China, South Asia and Central Asia. Review pursuant to Security Council resolution 1822 (2008) was concluded on 20 May 2010.","","","ACTIVE","1","No","","0","0","0","","","0","","","0","0","add","20130603","20130603","","A"
"113236","FREEZE-04-UN1267","ENTITY","None","Other","0","","Co-founded by Aiman Muhammed Rabi al-Zawahiri (QI.A.6.01), who was also its military leader. Review pursuant to Security Council resolution 1822 (2008) was concluded on 21 Jun. 2010.","","","ACTIVE","1","No","","0","0","0","","","0","","","0","0","add","20130603","20130603","","A"
"2971893","FREEZE-04-UN1267","ENTITY","None","Other","0","","Mainly active in the Russian Federation, Afghanistan and Pakistan. Led by Doku Khamatovich Umarov (QI.U.290.11.)","","","ACTIVE","1","No","","0","0","0","","","0","","","0","0","add","20130603","20130603","","A"
"113476","FREEZE-04-UN1267","ENTITY","None","Other","0","","Other Foreign Locations: Afghanistan, Bangladesh, Eritrea, Ethiopia, India, Iraq, West Bank and Gaza, Somalia and Syria. Federal Employer Identification Number (United States of America): 36-3804626. V.A.T. Number: BE 454,419,759. Review pursuant to Security Council resolution 1822 (2008) was concluded on 21 Jun. 2010.","","","ACTIVE","1","No","","0","0","0","","","0","","","0","0","add","20130603","20130603","","A"
"2921366","FREEZE-04-UN1267","ENTITY","None","Other","0","","Was established in Afghanistan in 1980. In 1993, Harakat-ul Jihad Islami merged with Harakat ul-Mujahidin (QE.H.8.01) to form Harakat ul-Ansar. In 1997, Harakat-ul Jihad Islami split from Harakat ul-Ansar and resumed using its former name. Operations are in India, Pakistan and Afghanistan. Banned in Pakistan.","","","ACTIVE","1","No","","0","0","0","","","0","","","0","0","add","20130603","20130603","","A"
"113263","FREEZE-04-UN1267","ENTITY","None","Other","0","","Associated with Jaish-i-Mohammed (QE.J.19.01), Lashkar i Jhangvi (LJ) (QE.L.96.03) and Lashkar-e-Tayyiba (QE.L.118.05). Active in Pakistan and Afghanistan. Banned in Pakistan. Review pursuant to Security Council resolution 1822 (2008) was concluded on 21 Jun. 2010.","","","ACTIVE","1","No","","0","0","0","","","0","","","0","0","add","20130603","20130603","","A"
"2758392","FREEZE-04-UN1267","ENTITY","None","Other","0","","Associated with Jemaah Islamiyah (QE.J.92.02) and the International Islamic Relief Organization, Philippines, Branch Offices (QE.I.126.06). Review pursuant to Security Council resolution 1822 (2008) was concluded on 28 Jun. 2010.","","","ACTIVE","1","No","","0","0","0","","","0","","","0","0","add","20130603","20130603","","A"
"2757745","FREEZE-04-UN1267","ENTITY","None","Other","0","","Associated with the Abu Sayyaf Group (QE.A.1.01) and Jemaah Islamiyah (QE.J.92.02). All offices closed in 2006 but as of early 2009, the IIRO office in Manila, the Philippines had reopened. Review pursuant to Security Council resolution 1822 (2008) was concluded on 28 Jun. 2010.","","","ACTIVE","1","No","","0","0","0","","","0","","","0","0","add","20130603","20130603","","A"
"114074","FREEZE-04-UN1267","ENTITY","None","Other","0","","Review pursuant to Security Council resolution 1822 (2008) was concluded on 9 Jul. 2010.","","","ACTIVE","1","No","","0","0","0","","","0","","","0","0","add","20130603","20130603","","A"
"113963","FREEZE-04-UN1267","ENTITY","None","Other","0","","Linked to the Riyadus-Salikhin Reconnaissance and Sabotage Battalion of Chechen Martyrs (RSRSBCM) (QE.R.100.03) and the Special Purpose Islamic Regiment (SPIR) (QE.S.101.03). Review pursuant to Security Council resolution 1822 (2008) was concluded on 17 May 2010.","","","ACTIVE","1","No","","0","0","0","","","0","","","0","0","add","20130603","20130603","","A"
"113853","FREEZE-04-UN1267","ENTITY","None","Other","0","","Founded and led by Najmiddin Kamolitdinovich Jalolov (QI.J.240.08) and Suhayl Fatilloevich Buranov (QI.B.239.08). Associated with the Islamic Movement of Uzbekistan (QE.I.10.01) and Emarat Kavkaz (QE.E.131.11). Active in the Afghanistan/Pakistan border area, Central Asia, South Asia region and some European States. Review pursuant to Security Council resolution 1822 (2008) was concluded on 20 May 2010.","","","ACTIVE","1","No","","0","0","0","","","0","","","0","0","add","20130603","20130603","","A"
"113964","FREEZE-04-UN1267","ENTITY","None","Other","0","","Associated with the Eastern Turkistan Islamic Movement (QE.E.88.02), Islamic Jihad Group (QE.I.119.05) and Emarat Kavkaz (QE.E.131.11). Active in the Afghanistan/Pakistan border area, northern Afghanistan and Central Asia. Review pursuant to Security Council resolution 1822 (2008) was concluded on 21 Jun. 2010.","","","ACTIVE","1","No","","0","0","0","","","0","","","0","0","add","20130603","20130603","","A"
"113965","FREEZE-04-UN1267","ENTITY","None","Other","0","","Based in Peshawar and Muzaffarabad, Pakistan Associated with Harakat ul-Mujahidin / HUM (QE.H.8.01), Lashkar-e-Tayyiba (QE.L.118.05), Al-Akhtar Trust International (QE.A.121.05), and Harakat-ul Jihad Islami (QE.H.130.10). Banned in Pakistan. Review pursuant to Security Council resolution 1822 (2008) was concluded on 21 Jun. 2010.","","","ACTIVE","1","No","","0","0","0","","","0","","","0","0","add","20130603","20130603","","A"
"113854","FREEZE-04-UN1267","ENTITY","None","Other","0","","Founded by Usama Mohammad Awad bin Laden (QI.B.8.01) in 2001. Review pursuant to Security Council resolution 1822 (2008) was concluded on 21 Jun. 2010.","","","ACTIVE","1","No","","0","0","0","","","0","","","0","0","add","20130603","20130603","","A"
"113967","FREEZE-04-UN1267","ENTITY","None","Other","0","","Operates in Southeast Asia, including Indonesia, Malaysia and the Philippines. Associated with the Abu Sayyaf Group (QE.A.1.01). Review pursuant to Security Council resolution 1822 (2008) was concluded on 25 May 2010.","","","ACTIVE","1","No","","0","0","0","","","0","","","0","0","add","20130603","20130603","","A"
"2983820","FREEZE-04-UN1267","ENTITY","None","Other","0","","Founded and led by Abu Bakar Ba''asyir (QI.B.217.06.). Established on 27 Jul. 2008 in Solo, Indonesia. Associated with Jemmah Islamiya (JI) (QE.J.92.02.). Website: http:/ansharuttauhid.com/","","","ACTIVE","1","No","","0","0","0","","","0","","","0","0","add","20130603","20130603","","A"
"114075","FREEZE-04-UN1267","ENTITY","None","Other","0","","Associated with the Libyan Islamic Fighting Group (QE.L.11.01). Review pursuant to Security Council resolution 1822 (2008) was concluded on 19 Jul. 2010.","","","ACTIVE","1","No","","0","0","0","","","0","","","0","0","add","20130603","20130603","","A"
"114076","FREEZE-04-UN1267","ENTITY","None","Other","0","","Associated with Hafiz Muhammad Saeed (QI.S.263.08) who is the leader of Lashkar-e-Tayyiba. Review pursuant to Security Council resolution 1822 (2008) was concluded on 8 Jun. 2010.","","","ACTIVE","1","No","","0","0","0","","","0","","","0","0","add","20130603","20130603","","A"
"114089","FREEZE-04-UN1267","ENTITY","None","Other","0","","Based primarily in Pakistan’s Punjab region and in the city of Karachi. Active in Pakistan although banned as at 2010. Review pursuant to Security Council resolution 1822 (2008) was concluded on 21 Jun. 2010.","","","ACTIVE","1","No","","0","0","0","","","0","","","0","0","add","20130603","20130603","","A"
